{
  "$schema": "./calibration-provenance.schema.json",
  "schemaVersion": 1,
  "policyVersion": "1.0.1",
  "lastReviewed": "2026-08-16",
  "allowedSourceLicenseExpressions": [
    "0BSD",
    "AGPL-3.0-only",
    "AGPL-3.0-or-later",
    "Apache-2.0",
    "BSD-2-Clause",
    "BSD-3-Clause",
    "GPL-3.0-only",
    "GPL-3.0-or-later",
    "ISC",
    "MIT",
    "MIT-0",
    "Unlicense",
    "Zlib"
  ],
  "governedPathPatterns": [
    "src/**/calibration/**",
    "src/**/CalibrationDerived/**",
    "src/**/calibration/derived/**",
    "src/calibration-derived/**"
  ],
  "approvedSources": [
    {
      "id": "orcaslicer-v2.4.2",
      "repositoryUrl": "https://github.com/OrcaSlicer/OrcaSlicer",
      "tag": "v2.4.2",
      "commitSha": "8500fcdccaa10b5099ac20d252af3a7c560046f1",
      "licenseExpression": "AGPL-3.0-only",
      "licenseEvidence": {
        "path": "LICENSE.txt",
        "blobDigest": "sha1:dba13ed2ddf783ee8118c6a581dbf75305f816a3"
      },
      "review": {
        "reviewer": "Copilot App",
        "reviewDate": "2026-08-20",
        "decision": "approved"
      }
    }
  ],
  "entries": [],
  "referenceRecords": [
    {
      "id": "calibration-api-contract-filter",
      "destinationPath": "src/api/Infrastructure/CalibrationApiContractAttribute.cs",
      "referenceUrls": [
        "https://github.com/OlyForge3D/PrintFarmer/issues/898"
      ],
      "statement": "Independent PrintFarmer implementation applying the established API contract negotiation to issue #898 routes; no external calibration source code was copied or adapted.",
      "review": {
        "reviewer": "Copilot App",
        "reviewDate": "2026-07-25",
        "decision": "approved"
      }
    },
    {
      "id": "calibration-blob-store",
      "destinationPath": "src/api/Services/Calibration/CalibrationBlobStore.cs",
      "referenceUrls": [
        "https://github.com/OlyForge3D/PrintFarmer/issues/898"
      ],
      "statement": "Independent PrintFarmer implementation of the issue #898 private authenticated photo storage contract; no external calibration source code was copied or adapted.",
      "review": {
        "reviewer": "Copilot App",
        "reviewDate": "2026-07-25",
        "decision": "approved"
      }
    },
    {
      "id": "calibration-blob-store-tests",
      "destinationPath": "src/tests/Farm.Web.Api.Tests/Services/Calibration/CalibrationBlobStoreTests.cs",
      "referenceUrls": [
        "https://github.com/OlyForge3D/PrintFarmer/issues/898"
      ],
      "statement": "Independent PrintFarmer test implementation of the issue #898 private photo storage requirements; no external calibration source code was copied or adapted.",
      "review": {
        "reviewer": "Copilot App",
        "reviewDate": "2026-07-25",
        "decision": "approved"
      }
    },
    {
      "id": "calibration-capabilities-controller",
      "destinationPath": "src/api/Controllers/CalibrationCapabilitiesController.cs",
      "referenceUrls": [
        "https://github.com/OlyForge3D/PrintFarmer/issues/895"
      ],
      "statement": "Independent PrintFarmer implementation of the issue #895 API contract; no external calibration source code was copied or adapted.",
      "review": {
        "reviewer": "Copilot App",
        "reviewDate": "2026-07-25",
        "decision": "approved"
      }
    },
    {
      "id": "calibration-capabilities-service",
      "destinationPath": "src/api/Services/Capabilities/CalibrationCapabilityService.cs",
      "referenceUrls": [
        "https://github.com/OlyForge3D/PrintFarmer/issues/895"
      ],
      "statement": "Independent PrintFarmer implementation of the issue #895 capability contract; no external calibration source code was copied or adapted.",
      "review": {
        "reviewer": "Copilot App",
        "reviewDate": "2026-07-25",
        "decision": "approved"
      }
    },
    {
      "id": "calibration-capabilities-tests",
      "destinationPath": "src/tests/Farm.Web.Api.Tests/Capabilities/CalibrationCapabilitiesTests.cs",
      "referenceUrls": [
        "https://github.com/OlyForge3D/PrintFarmer/issues/895"
      ],
      "statement": "Independent PrintFarmer test implementation of the issue #895 acceptance contract; no external calibration source code was copied or adapted.",
      "review": {
        "reviewer": "Copilot App",
        "reviewDate": "2026-07-25",
        "decision": "approved"
      }
    },
    {
      "id": "calibration-catalog-model-deriver",
      "destinationPath": "src/api/Services/Calibration/CalibrationCatalogModelDeriver.cs",
      "referenceUrls": [
        "https://github.com/OlyForge3D/PrintFarmer/issues/1922"
      ],
      "statement": "Independent PrintFarmer implementation of the issue #1922 printer-catalog calibration fallback tier (PrinterModel/PrinterModelToolhead/component-definition field derivation); no external calibration source code was copied or adapted.",
      "review": {
        "reviewer": "Copilot App",
        "reviewDate": "2026-08-23",
        "decision": "approved"
      }
    },
    {
      "id": "calibration-configuration-revision-tests",
      "destinationPath": "src/tests/Farm.Web.Api.Tests/Infrastructure/CalibrationConfigurationRevisionTests.cs",
      "referenceUrls": [
        "https://github.com/OlyForge3D/PrintFarmer/issues/896"
      ],
      "statement": "Independent PrintFarmer test implementation of the issue #896 configuration revision contract; no external calibration source code was copied or adapted.",
      "review": {
        "reviewer": "Copilot App",
        "reviewDate": "2026-07-25",
        "decision": "approved"
      }
    },
    {
      "id": "calibration-context-contracts",
      "destinationPath": "src/infra/Calibration/CalibrationContracts.cs",
      "referenceUrls": [
        "https://github.com/OlyForge3D/PrintFarmer/issues/896"
      ],
      "statement": "Independent PrintFarmer implementation of the issue #896 calibration candidate and immutable context contracts; no external calibration source code was copied or adapted.",
      "review": {
        "reviewer": "Copilot App",
        "reviewDate": "2026-07-25",
        "decision": "approved"
      }
    },
    {
      "id": "calibration-generation-kestrel-api-host",
      "destinationPath": "src/tests/Farm.Web.IntegrationTests/Calibration/KestrelCalibrationApiHost.cs",
      "referenceUrls": [
        "https://github.com/OlyForge3D/PrintFarmer/issues/899"
      ],
      "statement": "Independent PrintFarmer test support implementation hosting a Kestrel server for issue #899 calibration generation integration tests; no external calibration source code was copied or adapted.",
      "review": {
        "reviewer": "Copilot App",
        "reviewDate": "2026-07-26",
        "decision": "approved"
      }
    },
    {
      "id": "calibration-generation-orchestration-postgresql",
      "destinationPath": "src/migrations/Farm.Migrations.PostgreSQL/Migrations/20260730231346_InitialV2.cs",
      "referenceUrls": [
        "https://github.com/OlyForge3D/PrintFarmer/issues/899"
      ],
      "statement": "Independent PrintFarmer implementation generated by Entity Framework for the issue #899 calibration generation orchestration schema (PostgreSQL); no external calibration source code was copied or adapted. The originating migration was consolidated into the squashed InitialV2 baseline; this record now attests the baseline that carries that schema.",
      "review": {
        "reviewer": "Copilot App",
        "reviewDate": "2026-07-25",
        "decision": "approved"
      }
    },
    {
      "id": "calibration-generation-orchestration-postgresql-designer",
      "destinationPath": "src/migrations/Farm.Migrations.PostgreSQL/Migrations/20260730231346_InitialV2.Designer.cs",
      "referenceUrls": [
        "https://github.com/OlyForge3D/PrintFarmer/issues/899"
      ],
      "statement": "Independent PrintFarmer implementation generated by Entity Framework for the issue #899 calibration generation orchestration schema (PostgreSQL); no external calibration source code was copied or adapted. The originating migration was consolidated into the squashed InitialV2 baseline; this record now attests the baseline that carries that schema.",
      "review": {
        "reviewer": "Copilot App",
        "reviewDate": "2026-07-25",
        "decision": "approved"
      }
    },
    {
      "id": "calibration-generation-orchestration-sqlite",
      "destinationPath": "src/migrations/Farm.Migrations.Sqlite/Migrations/20260730231403_InitialV2.cs",
      "referenceUrls": [
        "https://github.com/OlyForge3D/PrintFarmer/issues/899"
      ],
      "statement": "Independent PrintFarmer implementation generated by Entity Framework for the issue #899 calibration generation orchestration schema (SQLite); no external calibration source code was copied or adapted. The originating migration was consolidated into the squashed InitialV2 baseline; this record now attests the baseline that carries that schema.",
      "review": {
        "reviewer": "Copilot App",
        "reviewDate": "2026-07-25",
        "decision": "approved"
      }
    },
    {
      "id": "calibration-generation-orchestration-sqlite-designer",
      "destinationPath": "src/migrations/Farm.Migrations.Sqlite/Migrations/20260730231403_InitialV2.Designer.cs",
      "referenceUrls": [
        "https://github.com/OlyForge3D/PrintFarmer/issues/899"
      ],
      "statement": "Independent PrintFarmer implementation generated by Entity Framework for the issue #899 calibration generation orchestration schema (SQLite); no external calibration source code was copied or adapted. The originating migration was consolidated into the squashed InitialV2 baseline; this record now attests the baseline that carries that schema.",
      "review": {
        "reviewer": "Copilot App",
        "reviewDate": "2026-07-25",
        "decision": "approved"
      }
    },
    {